{
 "schemaVersion": "1.0",
 "meta": {
  "description": "Curated routing signals for the 293 adapted community skills. Frozen by T26; see docs/community/ROUTE-RANKING.md and section 19 task card T26.",
  "owner": "T26",
  "registrySchemaVersion": "1.0",
  "consumer": "skills/scripts/community-route.py",
  "verifier": "skills/scripts/verify-routing-signals.py",
  "note": "Every noise[] pattern is measured against the real registry: an entry is admissible only if it matches at least 80% of the records of at least one source, and the measured per-source fraction is recorded in its own note. Every signals[] entry is mined, not invented: the domain term is absent from that record's own routing text under the engine's own tokeniser, and present verbatim in a file inside the record's own vendored directory, which is what evidence_kind raw re-checks mechanically. The two hyphen compounds the tokeniser swallows (BloodHound-guided, Lattice-based) are the reason a curated layer exists at all. The verifier prints every measurement and fails closed on all of them. short_tokens is a measured list rather than a guess at the tokeniser's blind spot: it originally admitted ai, and the post-ship measurement showed why that was harmful. The routing view hyphen-splits the source identifier ai-fullstack, so the token ai was present in 157 of the 293 records' routing texts and gave every one of them a NAME-level (weight 3) hit for any hint containing ai; lookup('ai') returned 3 wrappers at confidence 1.0 and was held back only by ambiguous_tie, i.e. the ambiguity rule was the only thing standing between a bare two-letter hint and a wrong routing answer. ai is therefore dropped. os, ot and s3 stay even though they occur in 0 of 293 routing texts, because a literal that matches nothing is useless but harmless while a literal that matches 157 records is harmful; design-freeze 1.1 only allows dropping a short token that can be demonstrated harmful, and that is the distinction being applied here."
 },
 "token_aliases": {
  "pcaps": "pcap",
  "yaras": "yara",
  "apks": "apk",
  "attacks": "attack",
  "endpoints": "endpoint",
  "exploits": "exploit",
  "hosts": "host",
  "keys": "key",
  "misconfigurations": "misconfiguration",
  "protocols": "protocol",
  "services": "service",
  "shells": "shell",
  "credentials": "credential",
  "applications": "application",
  "paths": "path",
  "headers": "header"
 },
 "short_tokens": [
  "ad",
  "ci",
  "db",
  "id",
  "io",
  "os",
  "ot",
  "s3"
 ],
 "noise": [
  {
   "pattern": "community-raw",
   "scope": "any",
   "note": "Measured 293/293 records of every source carry the vendored snapshot root inside path and source_path, so the literal is pure provenance and routable from nowhere. ctf-super-hub 35/35 = 100%, hack-skills 103/103 = 100%, ai-fullstack-delivery 154/154 = 100%, apk-reverse-community 1/1 = 100%."
  },
  {
   "pattern": "skills-hub",
   "scope": "any",
   "note": "The legacy importer injected this host-project name into keywords[] of all 293 records, so it can never discriminate between records. ctf-super-hub 35/35 = 100%, hack-skills 103/103 = 100%, ai-fullstack-delivery 154/154 = 100%, apk-reverse-community 1/1 = 100%."
  },
  {
   "pattern": "upstream",
   "scope": "any",
   "note": "Same importer boilerplate as the host name, also in keywords[] of 293/293 records and therefore a constant, not a signal. ctf-super-hub 35/35 = 100%, hack-skills 103/103 = 100%, ai-fullstack-delivery 154/154 = 100%, apk-reverse-community 1/1 = 100%."
  },
  {
   "pattern": "ai-fullstack-delivery",
   "scope": "any",
   "note": "The source identifier of one vendor tree, present in the path and keywords[] of that source's records and of no other record's. ai-fullstack-delivery 154/154 = 100%; it discriminates the source, never the capability, so it must not reach a hint."
  },
  {
   "pattern": "hack-skills",
   "scope": "any",
   "note": "The source identifier of the second vendor tree, in the path and keywords[] of its own records only. hack-skills 103/103 = 100%; routing on it would hand every hack-skills record to any hint that merely says where the skill came from."
  },
  {
   "pattern": "ctf-super-hub",
   "scope": "any",
   "note": "The source identifier of the third vendor tree, in the path and keywords[] of its own records only. ctf-super-hub 35/35 = 100%, which is why design-freeze 1.3 measures per source: a string covering 12% of the whole registry is still provably boilerplate for the source that owns it."
  }
 ],
 "signals": [
  {
   "id": "community-hack-skills-037",
   "must": [
    "\\bbloodhound\\b",
    "\\bmimikatz\\b",
    "\\bkerberoast(ing)?\\b",
    "\\bgpo\\b",
    "\\bdcsync\\b",
    "(?=.*权限)(?=.*写严)",
    "(?=.*权限)(?=.*访问)"
   ],
   "exclude": [],
   "evidence": "mimikatz",
   "evidence_kind": "raw",
   "note": "The AD ACL abuse body is built on credential-theft tooling: it names mimikatz, carries a BloodHound attack-path sheet, and walks the DCSync and GPO rights an operator actually abuses. None of that is routable today, because the frontmatter only says BloodHound-guided inside a hyphen compound the tokeniser swallows, so the single most characteristic verb of this record - dump the domain's credentials - reaches nothing."
  },
  {
   "id": "community-hack-skills-038",
   "must": [
    "\\bcertipy\\b",
    "\\bdcsync\\b",
    "\\besc[0-9]+\\b",
    "\\bpkinit\\b"
   ],
   "exclude": [],
   "evidence": "certipy",
   "evidence_kind": "raw",
   "note": "An AD CS abuse request almost always names Certipy or an ESC number, because those are how the ESC1-ESC13 matrix is actually executed. The record's body enumerates them and its own matrix file names Certipy dozens of times, while the frontmatter advertises only the generic template-abuse vocabulary."
  },
  {
   "id": "community-hack-skills-039",
   "must": [
    "\\brubeus\\b",
    "\\bkrbtgt\\b",
    "\\bas[- ]?reproast(ing)?\\b",
    "\\bgolden\\s+ticket",
    "\\bsilver\\s+ticket"
   ],
   "exclude": [],
   "evidence": "rubeus",
   "evidence_kind": "raw",
   "note": "Kerberos ticket work is named after its tools and artifacts: Rubeus, the krbtgt account, AS-REP roasting, golden and silver tickets. The description covers the techniques in prose, so a hint that says the tool name or the hash the operator is after finds no record at all today."
  },
  {
   "id": "community-hack-skills-090",
   "must": [
    "\\blattice\\b",
    "\\blll\\b",
    "\\bbkz\\b",
    "\\bcoppersmith\\b"
   ],
   "exclude": [],
   "evidence": "lattice",
   "evidence_kind": "raw",
   "note": "The record's entire subject is lattice reduction, but the frontmatter only says Lattice-based - a hyphen compound, so the tokeniser never emits the standalone word and a plain lattice hint gets zero references. The body is the deepest lattice material in the corpus, which makes this the clearest single recall hole in the registry."
  },
  {
   "id": "community-hack-skills-112",
   "must": [
    "\\bcoppersmith\\b",
    "\\bbkz\\b",
    "\\bwiener\\b",
    "\\bcommon[ -]?modulus\\b"
   ],
   "exclude": [],
   "evidence": "coppersmith",
   "evidence_kind": "raw",
   "note": "Given RSA parameters, operators name the specific attack they want - Coppersmith small roots, Wiener, a shared modulus - not the word RSA, which already routes on the slug. Without these the record stays invisible to the follow-up hint that actually carries the technique."
  },
  {
   "id": "community-hack-skills-123",
   "must": [
    "\\bbit[- ]?flip(ping)?\\b",
    "\\bcbc\\s*bit",
    "\\bmeet[- ]?in[- ]?the[- ]?middle\\b"
   ],
   "exclude": [],
   "evidence": "bitflip",
   "evidence_kind": "raw",
   "note": "A CBC or ECB bit-flipping request is almost always phrased as the attack, and the record's body gives the exact working cbc_bitflip routine plus the mitigation test. The frontmatter names the class of weakness but never the operation the caller is trying to perform."
  },
  {
   "id": "community-hack-skills-115",
   "must": [
    "\\becdsa\\b",
    "\\bmalleab(ility|le)\\b",
    "\\bpermit\\b",
    "\\bnonce\\s+reuse\\b"
   ],
   "exclude": [],
   "evidence": "ECDSA.recover",
   "evidence_kind": "raw",
   "note": "Signature replay in a smart contract is an ECDSA property: malleability or nonce reuse lets an attacker move an approval that was never meant to move. The audit body is written against the ECDSA.recover call, so an auditor who names the primitive is asking about this record specifically."
  },
  {
   "id": "community-hack-skills-077",
   "must": [
    "\\bhashcat\\b",
    "\\bjohn\\b",
    "\\bdictionary\\s+attack\\b",
    "\\brules?\\s+of\\s+hash"
   ],
   "exclude": [],
   "evidence": "hashcat",
   "evidence_kind": "raw",
   "note": "When someone asks how to attack a hash, they ask with the tool in hand - hashcat, john, a wordlist. The record covers length extension and collision classes, which the hint never mentions, so a practical cracking request currently reaches only generic web skills."
  },
  {
   "id": "community-hack-skills-058",
   "must": [
    "\\bvm[- ]?protect",
    "\\bstring\\s+encrypt(ion)?\\b",
    "\\bcontrol[- ]flow\\s+flat",
    "\\bopaque\\s+predicate",
    "\\bghidra\\b",
    "\\bangr\\b"
   ],
   "exclude": [],
   "evidence": "ghidra",
   "evidence_kind": "raw",
   "note": "The deobfuscation playbook is what an analyst reaches for once a packer or VM protector is named, and the body is organised around Ghidra and angr workflows. The frontmatter's generic junk-code wording does not contain the packer, protector or tool name the caller will actually type."
  },
  {
   "id": "community-hack-skills-129",
   "must": [
    "\\bbytecode\\b",
    "\\bdispatcher\\b",
    "\\bvm\\b",
    "\\bghidra\\b",
    "\\bunicorn\\b"
   ],
   "exclude": [],
   "evidence": "ghidra",
   "evidence_kind": "raw",